<?xml version="1.0" encoding="UTF-8"?>
<configuration xmlns:xsi="http://www.w3.org/2001/XMLSchema-instance"
	xsi:noNamespaceSchemaLocation="E:/Icaro/data/sm.xsd">
	<identifier>dc01</identifier>
	<description>urn:cloudicaro:DataCenter:01</description>
	<name>data center ICARO</name>
	<contacts />
	<type>System</type>
	<hosts>
		<host>
			<id>host01</id>
			<name>host1</name>
			<os>linux</os>
			<type>host</type>
			<ip_address>192.168.1.124</ip_address>
			<ip_address>192.168.0.125</ip_address>
			<monitor_info type="host">
				<metrics>
					<metric>
						<name>avgCPU%1m</name>
						<critical_value>80</critical_value>
						<warning_value>70</warning_value>
					</metric>
					<metric>
						<name>avgMem1m</name>
						<critical_value>80</critical_value>
						<warning_value>70</warning_value>
					</metric>
				</metrics>
			</monitor_info>
			<host_group>urn:cloudicaro:DataCenter:01</host_group>
			<domain_name>DC01</domain_name>
			<auth_pwd>xxx</auth_pwd>
			<auth_user>root</auth_user>
			<description>urn:cloudicaro:HostMachine:001</description>
		</host>
		<host>
			<id>host02</id>
			<name>host2</name>
			<os>linux</os>
			<type>host</type>
			<ip_address>192.168.1.125</ip_address>
			<monitor_info type="host">
				<metrics>
					<metric>
						<name>avgCPU%1m</name>
						<critical_value>80</critical_value>
						<warning_value>70</warning_value>
					</metric>
					<metric>
						<name>avgMem1m</name>
						<critical_value>80</critical_value>
						<warning_value>70</warning_value>
					</metric>
				</metrics>
			</monitor_info>
			<host_group>urn:cloudicaro:DataCenter:01</host_group>
			<domain_name>DC01</domain_name>
			<auth_pwd>xxx</auth_pwd>
			<auth_user>root</auth_user>
			<description>urn:cloudicaro:HostMachine:002</description>
		</host>
	</hosts>
	<devices>
		<device>
			<id>0001111</id>
			<device_type>ExternalStorage</device_type>
			<type>physical</type>
			<ip_address>192.168.1.100</ip_address>
			<ip_address>192.168.0.101</ip_address>
			<name>exstore01</name>
			<monitor_info type="device">
				<metrics>
					<metric>
						<name>avgCPU%1m</name>
						<critical_value>80</critical_value>
						<warning_value>70</warning_value>
						<args>args</args>
						<max_check_attempts>5</max_check_attempts>
						<check_interval>3</check_interval>
					</metric>
					<metric>
						<name>avgMem1m</name>
						<critical_value>80</critical_value>
						<warning_value>70</warning_value>
						<args>args</args>
						<max_check_attempts>5</max_check_attempts>
						<check_interval>3</check_interval>
					</metric>
				</metrics>
			</monitor_info>
			<description>urn:cloudicaro:ExternalStorage:001</description>
		</device>
		<device>
			<id>0001112</id>
			<device_type>ExternalStorage</device_type>
			<type>physical</type>
			<ip_address>192.168.1.102</ip_address>
			<ip_address>192.168.0.103</ip_address>
			<name>ex02</name>
			<monitor_info type="device">
				<metrics>
					<metric>
						<name>avgCPU%1m</name>
						<critical_value>80</critical_value>
						<warning_value>70</warning_value>
						<max_check_attempts>5</max_check_attempts>
						<check_interval>3</check_interval>
					</metric>
					<metric>
						<name>avgMem1m</name>
						<critical_value>80</critical_value>
						<warning_value>70</warning_value>
						<max_check_attempts>5</max_check_attempts>
						<check_interval>3</check_interval>
					</metric>
				</metrics>
			</monitor_info>
			<description>urn:cloudicaro:ExternalStorage:002</description>
		</device>
		<device>
			<id>fw1</id>
			<device_type>Firewall</device_type>
			<type>physical</type>
			<ip_address>192.168.1.1</ip_address>
			<ip_address>150.217.15.1</ip_address>
			<name>firewall 1</name>
			<monitor_info type="device">
				<metrics>
					<metric>
						<name>avgCPU%1m</name>
						<critical_value>80</critical_value>
						<warning_value>70</warning_value>
						<max_check_attempts>5</max_check_attempts>
						<check_interval>3</check_interval>
					</metric>
					<metric>
						<name>avgMem1m</name>
						<critical_value>80</critical_value>
						<warning_value>70</warning_value>
						<max_check_attempts>5</max_check_attempts>
						<check_interval>3</check_interval>
					</metric>
				</metrics>
			</monitor_info>
			<model>3COM</model>
			<description>urn:cloudicaro:Firewall:1</description>
		</device>
		<device>
			<id>rt:01</id>
			<device_type>Router</device_type>
			<type>physical</type>
			<ip_address>192.168.1.2</ip_address>
			<ip_address>192.168.0.2</ip_address>
			<name>router 1 to 2</name>
			<monitor_info type="device">
				<metrics>
					<metric>
						<name>avgCPU%1m</name>
						<critical_value>80</critical_value>
						<warning_value>70</warning_value>
						<max_check_attempts>5</max_check_attempts>
						<check_interval>3</check_interval>
					</metric>
					<metric>
						<name>avgMem1m</name>
						<critical_value>80</critical_value>
						<warning_value>70</warning_value>
						<max_check_attempts>5</max_check_attempts>
						<check_interval>6</check_interval>
					</metric>
				</metrics>
			</monitor_info>
			<model>3ROUTE</model>
			<description>urn:cloudicaro:Router:1</description>
		</device>
	</devices>
</configuration>