<?xml version="1.0" encoding="UTF-8"?><configuration xmlns:xsi="http://www.w3.org/2001/XMLSchema-instance"               xsi:noNamespaceSchemaLocation="E:/Icaro/data/sm.xsd">   <identifier>TEST-001</identifier>   <description>urn:cloudicaro:BusinessConfiguration:TEST-001</description>   <name>My Configuration</name>   <contacts>xyz@gmail.com</contacts>   <type>Business</type>   <applications>      <application>         <name>My ECLAP</name>         <id>xlms:001</id>         <description>urn:cloudicaro:XLMS:002</description>         <contacts>xyz@gmail.com;</contacts>         <services>            <service>               <id>AWS:001</id>               <name>Apache Web Server 001</name>               <type>ApacheWebServer</type>               <description>urn:cloudicaro:ApacheWebServer:002</description>               <ip_address/>               <service_group>ApacheWebServer</service_group>               <run_on>vm001</run_on>               <monitor_info type="service">                  <metrics>                     <metric>                        <name>checkHttp</name>                        <args>url:"http://www.ecalp.eu/",contains:"ECLAP"</args>                     </metric>                  </metrics>               </monitor_info>               <port>80</port>            </service>         </services>      </application>   </applications>   <tenants>      <tenant>         <name>OggiWebTenant</name>         <id>001</id>         <description>urn:cloudicaro:OggiWebTenant:001</description>         <contacts>xyz@gmail.com;</contacts>         <monitor_info type="tenant">            <metrics/>         </monitor_info>         <runOn>urn:cloudicaro:OggiWeb:001</runOn>      </tenant>   </tenants>   <hosts>      <host>         <id>vm001</id>         <name>VM001</name>         <os>windowsXP</os>         <type>vmhost</type>         <ip_address>192.168.1.23</ip_address>         <monitor_info type="host">            <metrics>               <metric>                  <name>avgCPU%1m</name>                  <critical_value>80</critical_value>                  <warning_value>70</warning_value>               </metric>            </metrics>         </monitor_info>         <parent_host>urn:cloudicaro:HostMachine:001</parent_host>      </host>   </hosts>   <devices/></configuration>